{
  "schema_version": "1.0.0",
  "job_id": "qav-20260919-0001",
  "project_key": "quiz-al-volo",
  "channel_profile": "quiz-al-volo",
  "created_at": "2026-09-19T12:00:00Z",
  "language": "it",
  "source": {
    "file_name": "master.mp4",
    "mime_type": "video/mp4",
    "sha256": "0000000000000000000000000000000000000000000000000000000000000000",
    "duration_ms": 42000,
    "width": 1920,
    "height": 1080,
    "frame_rate": 30
  },
  "content": {
    "episode_id": "qav-pilota-001",
    "title_hint": "Quanto conosci la geografia italiana?",
    "category": "geografia",
    "summary": "Esempio tecnico con una domanda, risposta e spiegazione.",
    "question_ids": [
      "geo-it-0001"
    ],
    "source_links": [
      {
        "title": "Fonte istituzionale di esempio",
        "url": "https://example.org/fonte"
      }
    ]
  },
  "segments": [
    {
      "segment_id": "hook-01",
      "type": "HOOK",
      "start_ms": 0,
      "end_ms": 2500,
      "text": "Vediamo se conosci questa curiosità geografica.",
      "region_of_interest": {
        "x": 0.2,
        "y": 0.05,
        "width": 0.6,
        "height": 0.9
      },
      "text_safe_area": {
        "x": 0.15,
        "y": 0.12,
        "width": 0.7,
        "height": 0.7
      }
    },
    {
      "segment_id": "question-01",
      "type": "QUESTION",
      "start_ms": 2500,
      "end_ms": 11000,
      "question_id": "geo-it-0001",
      "text": "Testo della domanda di esempio",
      "region_of_interest": {
        "x": 0.2,
        "y": 0.05,
        "width": 0.6,
        "height": 0.9
      },
      "text_safe_area": {
        "x": 0.15,
        "y": 0.12,
        "width": 0.7,
        "height": 0.7
      }
    },
    {
      "segment_id": "countdown-01",
      "type": "COUNTDOWN",
      "start_ms": 11000,
      "end_ms": 17000,
      "question_id": "geo-it-0001"
    },
    {
      "segment_id": "answer-01",
      "type": "ANSWER",
      "start_ms": 17000,
      "end_ms": 23000,
      "question_id": "geo-it-0001",
      "text": "Risposta di esempio"
    },
    {
      "segment_id": "explanation-01",
      "type": "EXPLANATION",
      "start_ms": 23000,
      "end_ms": 38000,
      "question_id": "geo-it-0001",
      "text": "Spiegazione editoriale di esempio. Sostituire con un contenuto approvato e verificato."
    },
    {
      "segment_id": "outro-01",
      "type": "OUTRO",
      "start_ms": 38000,
      "end_ms": 42000
    }
  ],
  "short_candidates": [
    {
      "candidate_id": "short-01",
      "segment_ids": [
        "hook-01",
        "question-01",
        "countdown-01",
        "answer-01",
        "explanation-01"
      ],
      "start_ms": 0,
      "end_ms": 38000,
      "priority": 1,
      "target_aspect_ratio": "9:16",
      "title_hint": "Sai rispondere a questa domanda di geografia?",
      "crop_region": {
        "x": 0.2,
        "y": 0,
        "width": 0.6,
        "height": 1
      },
      "must_include_explanation": true
    }
  ],
  "rights": {
    "source_owner_confirmed": true,
    "notes": "Fixture tecnica: non usare in produzione.",
    "assets": []
  },
  "youtube": {
    "default_language": "it",
    "made_for_kids": false,
    "contains_synthetic_media": false,
    "notify_subscribers": false,
    "category_hint": "Education",
    "playlist_hint": "Quiz di geografia",
    "hashtags_hint": [
      "#quiz",
      "#geografia"
    ]
  },
  "rendering": {
    "renderer": "example-renderer",
    "renderer_version": "0.0.0",
    "template_id": "contract-fixture",
    "template_version": "1.0.0"
  },
  "producer": {
    "repository": "https://github.com/example/quiz-al-volo",
    "git_commit": "aaaaaaaaaaaaaaaaaaaaaaaaaaaaaaaaaaaaaaaa",
    "catalog_version": "fixture-1"
  }
}
